index	branch	parent_commit	commit	recipe	metric_name	metric_value	memory_gb	elapsed_min	launcher	job_id	command	log_path	status	description
1	autoresearch/2026-08-23-glm51-production/sync-checkpoint	b23a0d582	working-tree	dpo-apertus1p5-8b-maxmin-megatron.yaml	fresh_allocation_resume	0	0	0	slurm	pending	probe_glm51_checkpoint_sync_overlay.slurm	logs/glm51_checkpoint_control_sync_*	pending	Current-stack synchronous save and fresh-allocation optimizer resume control
2	autoresearch/2026-08-23-glm51-production/sync-checkpoint	b23a0d582	working-tree	dpo-apertus1p5-8b-maxmin-megatron.yaml	fresh_allocation_resume	0	0	0	slurm	pending	probe_glm51_checkpoint_sync_overlay.slurm	logs/glm51_checkpoint_control_async_*	pending	Matched NVRx async save and fresh-allocation optimizer resume control
3	autoresearch/2026-08-23-glm51-production/sync-checkpoint	6f6d4c912	6f6d4c912	dpo-apertus1p5-8b-maxmin-megatron.yaml	optimizer_rank_shards	4	103	4	slurm	3162831	probe_glm51_checkpoint_sync_overlay.slurm	logs/glm51_checkpoint_control_sync_save_3162831/run.log	keep	Sync save produced complete 4/4-rank step_1 and step_2 checkpoints; wrapper-only cross-filesystem mv failure followed
4	autoresearch/2026-08-23-glm51-production/sync-checkpoint	6f6d4c912	6f6d4c912	dpo-apertus1p5-8b-maxmin-megatron.yaml	optimizer_rank_shards	4	103	4	slurm	3162855	probe_glm51_checkpoint_sync_overlay.slurm	logs/glm51_checkpoint_control_async_save_3162855/run.log	keep	NVRx save produced complete 4/4-rank step_1 and step_2 checkpoints; wrapper-only cross-filesystem mv failure followed
5	autoresearch/2026-08-23-glm51-production/sync-checkpoint	6f6d4c912	6f6d4c912	dpo-apertus1p5-8b-maxmin-megatron.yaml	fresh_allocation_next_step	2	0	3	slurm	3162832	probe_glm51_checkpoint_sync_overlay.slurm	logs/glm51_checkpoint_control_sync_resume_3162832/run.log	keep	Fresh allocation loaded sync step_1 optimizer state and completed outer training step 2
6	autoresearch/2026-08-23-glm51-production/sync-checkpoint	6f6d4c912	6f6d4c912	dpo-apertus1p5-8b-maxmin-megatron.yaml	fresh_allocation_next_step	2	0	3	slurm	3162856	probe_glm51_checkpoint_sync_overlay.slurm	logs/glm51_checkpoint_control_async_resume_3162856/run.log	keep	Fresh allocation loaded NVRx step_1 optimizer state and completed outer training step 2; stale iteration assertion caused wrapper exit 1
7	autoresearch/2026-08-23-glm51-production/sync-checkpoint	c2024a27b	c2024a27b	grpo-glm5.1-80n4g-megatron-async-vllm-tp32-checkpoint-save.yaml	launch_preflight	0	850	4.13	slurm	3163157	submit_glm51_cross_allocation_checkpoint.sh save	logs/glm51_cross_allocation_c2024a27b7f342b97f685c8fa3955f5a8494511a/save/run.log	drop	Failed before model initialization when uv rebuilt baked actor venvs in place on the writable container overlay; random package-directory File exists errors, no checkpoint evidence
8	autoresearch/2026-08-23-glm51-production/sync-checkpoint	6f9f581ff	6f9f581ff	grpo-glm5.1-80n4g-megatron-async-vllm-tp32-checkpoint-save.yaml	optimizer_rank_shards	230	850	40.8	slurm	3163625	submit_glm51_cross_allocation_checkpoint.sh save	logs/glm51_cross_allocation_6f9f581ff6007effeab9a063100d60b219ec7792/save/run.log	keep	Reached checkpoint; Slurm OOM-killed task 20 on nid006944. Rank 202 alone on that node missed its 29.52-GB shard while total node cgroup peaked at 334.78 GB of 891.29 GB; strict 120-GB NUMA membind is the initiating fault
9	autoresearch/2026-08-23-glm51-production/sync-checkpoint	526a5c6eb	526a5c6eb	grpo-glm5.1-80n4g-megatron-async-vllm-tp32-checkpoint-save.yaml	optimizer_rank_shards	288	850	39.6	slurm	3164148	submit_glm51_cross_allocation_checkpoint.sh save	logs/glm51_cross_allocation_526a5c6eb2f098d81f6a116267459242875b91d0/save/run.log	keep	Preferred-local NUMA policy completed all 288 optimizer shards totaling 8.926 TB plus both metadata files with no OOM; training loss 0.0190, reward 0.0312, generation KL 0.0028. Wrapper-only terminal artifact KeyError followed after glm51_cross_allocation_save=OK
10	autoresearch/2026-08-23-glm51-production/sync-checkpoint	7ff6d17a0	7ff6d17a0	grpo-glm5.1-80n4g-megatron-async-vllm-tp32-checkpoint-resume.yaml	fresh_allocation_resume	0	95	pending	slurm	3165089	submit_glm51_cross_allocation_checkpoint.sh resume	logs/glm51_cross_allocation_526a5c6eb2f098d81f6a116267459242875b91d0/resume/run.log	crash	Checkpoint load reached Transformer Engine FusedAdam state initialization, then CUDA-OOMed only on global ranks 272-287, exactly the 16 DP replicas of heavy PP stage 17; no next training step and no evidence of corruption
11	autoresearch/2026-08-23-glm51-production/sync-checkpoint	5b433056a	working-tree	grpo-glm5.1-80n4g-megatron-tp2pp18ep16-async-vllm-tp32-checkpoint-save.yaml	fresh_allocation_resume	0	0	0	slurm	pending	submit_glm51_cross_allocation_checkpoint.sh save	logs/glm51_cross_allocation_tp2_<commit>/save/run.log	pending	No-fix TP2/PP18/ETP1/EP16 Phase A/B test; regenerate optimizer checkpoint at TP2, then restore in a fresh allocation
12	autoresearch/2026-08-23-glm51-production/sync-checkpoint	5b433056a	18621feb3	grpo-glm5.1-80n4g-megatron-tp2pp18ep16-async-vllm-tp32-checkpoint-save.yaml	optimizer_rank_shards	288	850	43.6	slurm	3168499	submit_glm51_cross_allocation_checkpoint.sh save	logs/glm51_cross_allocation_tp2_18621feb3aab7940d5113d79efba2eebb9b89943/save/run.log	keep	Unpatched TP2 Phase A completed step 1 and wrote a complete 288-shard 8.946-TB optimizer checkpoint with DCP metadata; loss 0.0240, reward range 0-1, generation KL 0.0027
13	autoresearch/2026-08-23-glm51-production/sync-checkpoint	18621feb3	18621feb3	grpo-glm5.1-80n4g-megatron-tp2pp18ep16-async-vllm-tp32-checkpoint-resume.yaml	fresh_allocation_resume	0	93	11.1	slurm	3168898	submit_glm51_cross_allocation_checkpoint.sh resume	logs/glm51_cross_allocation_tp2_18621feb3aab7940d5113d79efba2eebb9b89943/resume/run.log	crash	Unpatched TP2 fresh-allocation restore CUDA-OOMed on final-stage ranks 272-287 while TE FusedAdam initialized loaded optimizer state; only 12-277 MiB remained free and PyTorch held about 92.6-93.0 GiB
14	autoresearch/2026-08-24-glm51-tp2-cpu-placeholder	18621feb3	8c9c07984	grpo-glm5.1-80n4g-megatron-tp2pp18ep16-async-vllm-tp32-checkpoint-resume.yaml	launch_preflight	0	0	4.6	slurm	3168998	submit_glm51_cross_allocation_checkpoint.sh resume	logs/glm51_cross_allocation_tp2_cpu_placeholder_8c9c07984/resume/run.log	drop	Failed before Megatron because the fresh NeMo worktree had uninitialized recursive submodules; launcher now fails this condition before requesting nodes
15	autoresearch/2026-08-24-glm51-tp2-cpu-placeholder	8c9c07984	cad22f4	grpo-glm5.1-80n4g-megatron-tp2pp18ep16-async-vllm-tp32-checkpoint-resume.yaml	fresh_allocation_resume	0	60	13.5	slurm	3169053	submit_glm51_cross_allocation_checkpoint.sh resume	logs/glm51_cross_allocation_tp2_cpu_placeholder_8c9c07984_r2/resume/run.log	crash	A CPU-only DCP placeholder was insufficient because torch.optim.Optimizer.load_state_dict recast it to CUDA before TE allocated final scaled state; restore still OOMed
16	autoresearch/2026-08-24-glm51-tp2-cpu-placeholder	8c9c07984	c1dfe0617	grpo-glm5.1-80n4g-megatron-tp2pp18ep16-async-vllm-tp32-checkpoint-resume.yaml	fresh_allocation_resume	0	0	17.3	slurm	3169260	submit_glm51_cross_allocation_checkpoint.sh resume	logs/glm51_cross_allocation_tp2_dcp_no_cast_c1dfe0617/resume/run.log	crash	Direct-state load reached all ranks but exposed a pinned-MCore/TE-2.15 API mismatch before checkpoint tensor load: initialize_state lacked store_param_remainders
17	autoresearch/2026-08-24-glm51-tp2-cpu-placeholder	8c9c07984	23ae88370	grpo-glm5.1-80n4g-megatron-tp2pp18ep16-async-vllm-tp32-checkpoint-resume.yaml	fresh_allocation_next_step	2	63	34.1	slurm	3169314	submit_glm51_cross_allocation_checkpoint.sh resume	logs/glm51_cross_allocation_tp2_dcp_no_cast_v2_23ae88370/resume/run.log	keep	Clean MCore patch loaded the optimizer directly into TE final state on all 288 ranks, including 272-287, leaving about 26.5 GiB free versus near zero unpatched; fresh process completed step 2 with loss 0.0295, reward range 0-1, generation KL 0.0025, refit and exit 0
18	main	d2e1e082f	c85af58d9	grpo-glm5.1-80n4g-megatron-tp2pp18ep16-async-vllm-tp32-checkpoint-resume.yaml	publication_merge	1	0	0	github	PR-26	gh pr merge 26	https://github.com/Alvorecer721/Nemo-RL/pull/26	keep	Merged the runtime-proven MCore and Bridge pins plus GLM checkpoint harness after all substantive fork CI passed; only the permission-limited PR-comment publisher remained red
19	autoresearch/glm51-r3-10step-20260824	ce23215a4	314e22e20	.tmp/glm51-sc-probe/test_nccl_wire.slurm	focused_tests_passed	17	0	0.97	slurm	3181797	sbatch .tmp/glm51-sc-probe/test_nccl_wire.slurm	/iopsstor/scratch/cscs/xyixuan/nemo_rl_glm51_sc_probe/nccl_wire_3181797.out	keep	Exact-image Gloo, real two-GPU NCCL, byte-helper and current-topology padding regressions all passed with Ruff and formatting
20	autoresearch/glm51-r3-10step-20260824	070abefa6	314e22e20	.tmp/glm51-sc-probe/config.yaml	training_step_completed	1	0	0	slurm	3181802	bash .tmp/glm51-sc-probe/submit.sh	/iopsstor/scratch/cscs/xyixuan/nemo_rl_glm51_sc_probe/314e22e20266eefa8a0ea98f4ac7826df7ddee57/3181802	keep	Controlled 72-train/8-inference SingleController step completed with loss 0.07355, reward 0.14844, KL 0.0003694 and no stale/dropped groups; terminal postcheck alone failed because process-local TQ trace sampling made the validator reject valid worker fetches
21	autoresearch/glm51-r3-10step-20260824	3e67e923e	68c9f52c0	.tmp/glm51-sc-probe/test_nccl_wire.slurm	focused_tests_passed	76	0	1.01	slurm	3182189	sbatch .tmp/glm51-sc-probe/test_nccl_wire.slurm	/iopsstor/scratch/cscs/xyixuan/nemo_rl_glm51_sc_probe/nccl_wire_3182189.out	keep	Exact-image gate passed all SingleController tail-metric, legacy and SC validator, TQ trace, padding, Gloo and real two-GPU NCCL tests with Ruff and formatting
22	autoresearch/glm51-r3-10step-20260824	68c9f52c0	6366a7599	.tmp/glm51-sc-scale/config.yaml	windowed_10step_running	6	0	203.0	slurm	3182849	bash .tmp/glm51-sc-scale/submit.sh	/iopsstor/scratch/cscs/xyixuan/nemo_rl_glm51_sc_scale/6366a7599e1156d1c782512173ab04cb01a7ea7d/3182849	running	Frozen 88-node windowed baseline reached step 7 with generation KL below 0.001; exposed stale-work waste includes 14 aborted in-flight groups after step 5 and completed-group evictions
23	autoresearch/glm51-ready-first-20260825	6366a7599	d071be968	examples/configs/recipes/llm/autoresearch/grpo-glm5.1-88n4g-megatron-tp2pp18ep16-ready-first.yaml	ready_first_partial	3	0	81.12	slurm	3184823	GLM_EXPECTED_SAMPLER=ready_first bash .tmp/glm51-sc-scale/submit.sh	/iopsstor/scratch/cscs/xyixuan/nemo_rl_glm51_ready_first/d071be968/3184823	keep	User-cancelled after three correctness-green steps because two TP32 rollout replicas remained too slow; preserve as partial sampler evidence, not a ten-step verdict
