index	track	branch	parent_commit	commit	recipe	metric_name	metric_value	memory_gb	elapsed_min	launcher	job_id	command	log_path	status	description
101	apertus1p5-8b-cross-allocation-checkpoint	chore/sync-upstream-7ea279abf	7ea279abfbeb698b092856d0dab61e7cf39bc909	084ade845b8421ab82dcda1849d913da517f194e	dpo-apertus1p5-8b-maxmin-megatron.yaml	optimizer_checkpoint_restore	1	1.0	3.93	sbatch	3156330	clean env-i fresh-allocation CHECKPOINT_MODE=resume	.tmp/nemo-upstream-7ea-curated/logs/exact_dpo_resume_20260823T0338/run.log	keep	COMPLETED 0:0. Optimizer state detected and restored from isolated step_1; fresh process trained step 2 with loss 0.7125550508499146, saved the next checkpoint, and emitted baked_dpo_cross_allocation_resume=OK.
102	apertus1p5-8b-async	chore/sync-upstream-7ea279abf	7ea279abfbeb698b092856d0dab61e7cf39bc909	084ade845b8421ab82dcda1849d913da517f194e	grpo-apertus1p5-8b-1n4g-megatron-probe-async.yaml	generation_kl_error	0.0003	0.0003	4.27	sbatch	3156321	clean env-i sbatch async GRPO	.tmp/nemo-upstream-7ea-curated/logs/exact_async_20260823T0338/run.log	keep	COMPLETED 0:0. Two async steps, CUDA graphs, successful refits and generation KL 0.0003 on both steps. Tiny sample had zero reward and is runtime/refit evidence only.
103	sglang-text-exact-image	chore/sync-upstream-7ea279abf	7ea279abfbeb698b092856d0dab61e7cf39bc909	084ade845b8421ab82dcda1849d913da517f194e	grpo_math_1B_sglang.yaml	generation_kl_error	0.0003	0.0003	5.13	sbatch	3156323	clean env-i sbatch SGLangGenerationWorker	.tmp/nemo-upstream-7ea-curated/logs/exact_sglang_20260823T0338/run.log	keep	COMPLETED 0:0. Four HTTP servers accepted weight updates and cache flush, one training step completed, and generation KL was 0.0003. Automodel async checkpointing remains disabled by its inherited Torch-version string comparison bug.
104	apertus1p5-8b-pp2-refit	chore/sync-upstream-7ea279abf	7ea279abfbeb698b092856d0dab61e7cf39bc909	084ade845b8421ab82dcda1849d913da517f194e	grpo-apertus1p5-8b-1n4g-megatron-probe.yaml	generation_kl_error	0	0.0	0.45	sbatch	3156324	clean env-i sbatch MEGATRON_TP_SIZE=2 MEGATRON_PP_SIZE=2	.tmp/nemo-upstream-7ea-curated/logs/exact_pp2_20260823T0338/run.log	crash	FAILED 1:0 before model load/refit. Base interpreter could not import Bridge because it is intentionally frozen only in the Megatron worker venv; commit 3ea1aa1ce adds bundled-source discovery and must be certified in the final image.
105	exact-image-host-preflight	chore/sync-upstream-7ea279abf	7ea279abfbeb698b092856d0dab61e7cf39bc909	deedf0c8bb2462b9e6bc5c3bbef096758053deef	tools/generate_fingerprint.py	host_fingerprint_python	1	1.0	0.17	sbatch	3156358	clean bare-host /usr/bin/python3.11 fingerprint JSON validation	.tmp/nemo-upstream-7ea-curated/logs/nrl-host-python-fingerprint-3156358.out	keep	COMPLETED 0:0. Clariden bare host has python3 3.6.15 and python3.11; the pinned /usr/bin/python3.11 path generated and parsed the exact fingerprint successfully.
106	exact-image-build	chore/sync-upstream-7ea279abf	7ea279abfbeb698b092856d0dab61e7cf39bc909	deedf0c8bb2462b9e6bc5c3bbef096758053deef	docker/Dockerfile	final_exact_image	0	0.0	0.0	sbatch	3156361	clean env-i two-allocation release assembly	.tmp/nemo-upstream-7ea-curated/logs/nrl-vllm0251-image_3156361.out	running	Final exact-source release assembly from hermetic cache ae440a7e8b2ab39353e47d5d879e9cfcbb3f6bdda5ca3133015592611772141d; startup/fingerprint contract passed, cached layer import is active.
107	exact-image-build	chore/sync-upstream-7ea279abf	7ea279abfbeb698b092856d0dab61e7cf39bc909	2091e790e7e42317aabf10d415a7f897f94cfafa	docker/Dockerfile	final_exact_image	0	0.0	0.0	sbatch	3156398	clean env-i two-allocation release assembly	.tmp/nemo-upstream-7ea-curated/logs/nrl-vllm0251-image_3156398.out	running	Supersedes intentionally cancelled 3156361 after mandatory DCO sign-off amendment. All 19 fork commits are signed; final assembly reuses hermetic cache ae440a7e8b2ab39353e47d5d879e9cfcbb3f6bdda5ca3133015592611772141d.
108	exact-image-build	chore/sync-upstream-7ea279abf	7ea279abfbeb698b092856d0dab61e7cf39bc909	2091e790e7e42317aabf10d415a7f897f94cfafa	docker/Dockerfile	canonical_pr_head	0	0.0	21.53	sbatch	3156398	clean env-i two-allocation release assembly	.tmp/nemo-upstream-7ea-curated/logs/nrl-vllm0251-image_3156398.out	discard	Intentionally CANCELLED at step 39/56 after publication audit confirmed PR #24 requires the fork's canonical two-parent history join. No dependency compilation was lost; replay tree remained unchanged.
109	exact-image-build	chore/sync-upstream-7ea279abf	7ea279abfbeb698b092856d0dab61e7cf39bc909	ec97553b15c40fc633b6d4efa4008d63a9f66a15	docker/Dockerfile	final_exact_image	0	0.0	0.0	sbatch	3156544	clean env-i canonical-HEAD release assembly	.tmp/nemo-upstream-7ea-curated/logs/nrl-vllm0251-image_3156544.out	running	Definitive exact PR HEAD after canonical history join and two-character inherited whitespace cleanup; reuses hermetic dependency cache ae440a7e8b2ab39353e47d5d879e9cfcbb3f6bdda5ca3133015592611772141d.
110	exact-image-build	chore/sync-upstream-7ea279abf	7ea279abfbeb698b092856d0dab61e7cf39bc909	8f22e59195f547c5715ed250cd49d4776cda5d43	docker/Dockerfile	final_exact_image	0	0.0	0.0	sbatch	3156560	clean env-i scanner-stable canonical-HEAD release assembly	.tmp/nemo-upstream-7ea-curated/logs/nrl-vllm0251-image_3156560.out	running	Definitive PR head after copyright, inline digest allowlists and secrets-baseline refresh; substantive hosted CI green and hermetic cache ae440a7e8b2ab39353e47d5d879e9cfcbb3f6bdda5ca3133015592611772141d restoring.
111	exact-image-build	chore/sync-upstream-7ea279abf	8f22e59195f547c5715ed250cd49d4776cda5d43	8f22e59195f547c5715ed250cd49d4776cda5d43	docker/Dockerfile	image_sha256	4aaf2b1bba8613a1e515281d84ab9e330c41d2774ccd3992b5f0c0f81e9dd002	47.0	127.67	sbatch	3156560	clean env-i two-allocation exact-head release build	.tmp/nemo-upstream-7ea-curated/logs/nrl-vllm0251-image_3156560.out	keep	COMPLETED 0:0. Published 50,049,777,664-byte valid SquashFS for exact source 8f22e591; built-in runtime smoke passed.
112	apertus1p5-70b-exact-preflight	autoresearch/2026-08-23-apertus70b-cert/exact-image	8f22e59195f547c5715ed250cd49d4776cda5d43	92db67ae02447354c3163e102d97129943d05f93	grpo-apertus1p5-70b-5n4g-megatron-async-vllm-tp4-smoke.yaml	exact_image_preflight	1	1.0	1.48	sbatch	3156865	clean env-i APERTUS70B_PREFLIGHT_ONLY=1	.tmp/apertus70b-exact-cert/logs/apertus70b_async_smoke/slurm_3156865.out	keep	COMPLETED 0:0. Exact source/image/checkpoint/cache/data/topology, NCCL reshard, CUDA xIELU, tests, Ruff and formatting passed.
113	apertus1p5-8b-pp2-refit	chore/sync-upstream-7ea279abf	8f22e59195f547c5715ed250cd49d4776cda5d43	8f22e59195f547c5715ed250cd49d4776cda5d43	grpo-apertus1p5-8b-1n4g-megatron-probe.yaml	generation_kl_error	0.0002	0.0002	4.88	sbatch	3156866	clean env-i Megatron TP2 PP2 exact image	.tmp/nemo-upstream-7ea-curated/logs/exact_pp2_final_8f22/run.log	keep	COMPLETED 0:0. Refit, generation, logprobs, backward and training passed with baked_grpo_refit=OK.
114	glm5p1-vllm-scale-prototype	autoresearch/2026-08-23-glm51-prototype/exact-image	8f22e59195f547c5715ed250cd49d4776cda5d43	76217c755e43a0a347a43cfc8d0990e17d06a735	probe_glm51_vllm_tp32_async.slurm	output_tokens_per_second	92.936	92.936	14.07	sbatch	3156867	clean env-i offline exact-image TP32 EP32	.tmp/glm51-exact-prototype/logs/glm51_exact_vllm_tp32_3156867/run.log	keep	COMPLETED 0:0 on 8 nodes/32 GH200. Loaded 282 shards, semantic arithmetic passed, peak HBM about 74.00 GiB/GPU. Scale prototype only.
115	apertus1p5-70b-async-production	autoresearch/2026-08-23-apertus70b-cert/exact-image	8f22e59195f547c5715ed250cd49d4776cda5d43	92db67ae02447354c3163e102d97129943d05f93	grpo-apertus1p5-70b-5n4g-megatron-async-vllm-tp4-smoke.yaml	generation_kl_error	0.000951	0.000994	9.43	sbatch	3156886	clean env-i exact-image TP4 PP4 train plus TP4 async rollout	.tmp/apertus70b-exact-cert/logs/apertus70b_async_smoke/run_20260823T044937Z_235193/run.log	keep	COMPLETED 0:0. Three refits and three learning steps; reward 0..1 and nonzero advantages every step; final 128.98 E2E tok/s/GPU and 14.96% measured MFU; terminal-green evidence written.
