index	track	branch	parent_commit	commit	recipe	metric_name	metric_value	memory_gb	elapsed_min	launcher	job_id	command	log_path	status	description
1	apertus70b	codex/sync-upstream-36b5999a7-replay	a2de667546e760134ca50cd27fed5d556208e7be	6bb1dfe49b3a5a7079c96344f085f9a1b1862851	examples/configs/recipes/llm/dpo-apertus1p5-8b-maxmin-megatron.yaml	steady_training_mfu_percent	0.0	0.0	0.70	sbatch	3146197	sbatch --nodes=4 .tmp/apertus70b_perf/launch_apertus70b_dpo_topology.slurm tp4pp4	.tmp/nemo-upstream-replay/.tmp/apertus70b_perf/slurm_3146197.out	crash	Invalid embedded-Python quoting before model setup; no topology evidence
2	apertus70b	codex/sync-upstream-36b5999a7-replay	a2de667546e760134ca50cd27fed5d556208e7be	6bb1dfe49b3a5a7079c96344f085f9a1b1862851	examples/configs/recipes/llm/dpo-apertus1p5-8b-maxmin-megatron.yaml	steady_training_mfu_percent	0.0	0.0	1.52	sbatch	3146221	sbatch --nodes=4 .tmp/apertus70b_perf/launch_apertus70b_dpo_topology.slurm tp4pp4	.tmp/nemo-upstream-replay/.tmp/apertus70b_perf/runs/tp4pp4_3146221/run.log	crash	Worker uv sync rejected incomplete isolated workspace before Megatron model creation; no topology evidence
3	glm5p1-rollout	codex/sync-upstream-36b5999a7-replay	a2de667546e760134ca50cd27fed5d556208e7be	a2de667546e760134ca50cd27fed5d556208e7be	.tmp/glm5p1_vllm_preflight/probe_glm5p1_vllm_tp32_async.py	output_tokens_per_second	70.021	76.296	4.72	sbatch	3146203	sbatch .tmp/glm5p1_vllm_preflight/probe_glm5p1_vllm_tp32_async.slurm	.tmp/nemo-upstream-replay/.tmp/glm5p1_vllm_preflight/run_3146203/run.log	keep	Dummy/refit-ready GLM-5.1 TP32/EP32 async engine initialized in 171.577s and generated 2048 tokens in 29.248s; architecture-fit only; COMPLETED 0:0
4	glm5p1-rollout	codex/sync-upstream-36b5999a7-replay	a2de667546e760134ca50cd27fed5d556208e7be	a2de667546e760134ca50cd27fed5d556208e7be	.tmp/glm5p1_vllm_preflight/probe_glm5p1_vllm_tp32_async.py	output_tokens_per_second	0.0	0.0	0.15	sbatch	3146238	sbatch .tmp/glm5p1_vllm_preflight/probe_glm5p1_vllm_tp32_async.slurm	.tmp/nemo-upstream-replay/.tmp/glm5p1_vllm_preflight/slurm_3146238.err	crash	Pyxis container start interrupted before probe execution; no model evidence
5	glm5p1-async-config	autoresearch/2026-08-22-glm51-async/tp32-baseline	6bb1dfe49b3a5a7079c96344f085f9a1b1862851	965e68e1e0949e42f989cfb57eb5aee0651387b8	examples/configs/recipes/llm/autoresearch/grpo-glm5.1-80n4g-megatron-async-vllm-tp32-smoke.yaml	config_preflight_exit_code	0	0.0	0.77	sbatch	3146293	sbatch infra/slurm/cscs/autoresearch/preflight_glm51_async_config.slurm	.tmp/glm51-async-topology/logs/glm51_async_smoke/config_3146293/preflight.log	keep	Exact-image MasterConfig topology and NCCL-reshard compatibility passed; COMPLETED 0:0
6	glm5p1-rollout-real	codex/sync-upstream-36b5999a7-replay	a2de667546e760134ca50cd27fed5d556208e7be	a2de667546e760134ca50cd27fed5d556208e7be	.tmp/glm5p1_vllm_preflight/probe_glm5p1_vllm_tp32_async.py	output_tokens_per_second	98.741	73.980	19.77	sbatch	3146245	sbatch .tmp/glm5p1_vllm_preflight/probe_glm5p1_vllm_tp32_async.slurm	.tmp/nemo-upstream-replay/.tmp/glm5p1_vllm_preflight/run_3146245/run.log	keep	Real GLM-5.1 TP32/EP32 async engine loaded all 282 shards, passed deterministic arithmetic semantics, measured 93.15 percent mean GPU use, and completed 0:0
7	glm5p1-async-smoke	autoresearch/2026-08-22-glm51-async/tp32-baseline	6bb1dfe49b3a5a7079c96344f085f9a1b1862851	965e68e1e0949e42f989cfb57eb5aee0651387b8	examples/configs/recipes/llm/autoresearch/grpo-glm5.1-80n4g-megatron-async-vllm-tp32-smoke.yaml	end_to_end_steps	0	0.0	1.20	sbatch	3146357	bash infra/slurm/cscs/autoresearch/submit_glm51_async_smoke.sh	.tmp/glm51-async-topology/3146357-logs/ray-driver.log	crash	Ray reached 320 of 320 GPUs; driver expected SLURM_JOB_ID after ray.sub intentionally clears SLURM variables and exited before NeMo import; no model evidence
8	glm5p1-async-throughput-config	autoresearch/2026-08-22-glm51-async/tp32-throughput-10step	965e68e1e0949e42f989cfb57eb5aee0651387b8	008725773c50d7d158785a31bfebd9aa169a6b29	examples/configs/recipes/llm/autoresearch/grpo-glm5.1-80n4g-megatron-async-vllm-tp32-throughput.yaml	config_preflight_exit_code	0	0.0	0.75	sbatch	3146355	sbatch infra/slurm/cscs/autoresearch/preflight_glm51_async_benchmark.slurm	.tmp/glm51-async-topology/logs/glm51_async_benchmark/config_3146355/preflight.log	keep	Exact-image DAPO data checksum and 1791700 rows, parser, config, topology, NCCL refit, and output gates passed; COMPLETED 0:0
9	glm5p1-async-smoke	autoresearch/2026-08-22-glm51-async/tp32-throughput-10step	008725773c50d7d158785a31bfebd9aa169a6b29	3d1b203470ab19a69a1d473b47e2f67d30b3f05a	examples/configs/recipes/llm/autoresearch/grpo-glm5.1-80n4g-megatron-async-vllm-tp32-smoke.yaml	end_to_end_steps	0	0.0	5.80	sbatch	3146379	bash infra/slurm/cscs/autoresearch/submit_glm51_async_smoke.sh	.tmp/glm51-async-topology/logs/glm51_async_smoke/run_20260822T002244Z_83842/run.log	crash	Launcher and 320-GPU Ray gates passed; 7 of 80 policy venv builders failed rewriting mismatched image-prewarmed source-overlay venvs; cancelled before model setup
10	apertus70b	codex/sync-upstream-36b5999a7-replay	a2de667546e760134ca50cd27fed5d556208e7be	6bb1dfe49b3a5a7079c96344f085f9a1b1862851	examples/configs/recipes/llm/dpo-apertus1p5-8b-maxmin-megatron.yaml	steady_training_mfu_percent	18.5295	78.718	32.67	sbatch	3146385	sbatch --nodes=4 .tmp/apertus70b_perf/launch_apertus70b_dpo_topology.slurm tp4pp4	.tmp/nemo-upstream-replay/.tmp/apertus70b_perf/runs/tp4pp4_3146385/summary.json	keep	COMPLETED 0:0; 10/10 DPO steps; steady steps 3-10 mean 19.349 s, 183.35 TFLOP/s/GPU, 18.53% external GH200 BF16 MFU, 85.70 valid tok/s/GPU
11	glm5p1-async-smoke	autoresearch/2026-08-22-glm51-async/tp32-throughput-10step	3d1b203470ab19a69a1d473b47e2f67d30b3f05a	5c53ef91f7c47420ae490ab392ab5b3bd0486a96	examples/configs/recipes/llm/autoresearch/grpo-glm5.1-80n4g-megatron-async-vllm-tp32-smoke.yaml	end_to_end_steps	0	76.204	14.25	sbatch	3146404	bash infra/slurm/cscs/autoresearch/submit_glm51_async_smoke.sh	.tmp/glm51-async-topology/logs/glm51_async_smoke/run_20260822T002911Z_525/run.log	crash	Ray 320/320, 160/160 clean actor venvs, vLLM 32/32 and Megatron 288-rank model construction passed; first torch_dist conversion save failed in WORLD all_gather_object sharding-integrity metadata decode before refit
12	apertus70b	codex/sync-upstream-36b5999a7-replay	a2de667546e760134ca50cd27fed5d556208e7be	6bb1dfe49b3a5a7079c96344f085f9a1b1862851	examples/configs/recipes/llm/dpo-apertus1p5-8b-maxmin-megatron.yaml	steady_training_mfu_percent	12.7315	90.599	21.83	sbatch	3146572	sbatch --nodes=4 .tmp/apertus70b_perf/launch_apertus70b_dpo_topology.slurm tp2pp8	.tmp/nemo-upstream-replay/.tmp/apertus70b_perf/runs/tp2pp8_3146572/summary.json	discard	COMPLETED 0:0; 10/10 DPO steps; steady steps 3-10 mean 28.143 s, 125.98 TFLOP/s/GPU, 12.73% external GH200 BF16 MFU, 58.89 valid tok/s/GPU; slower and higher peak HBM than TP4/PP4
13	glm5p1-conversion-config	autoresearch/2026-08-22-glm51-async/tp32-throughput-10step	5c53ef91f7c47420ae490ab392ab5b3bd0486a96	089a9a6fb2074d7676b5eb1192d81a93ed455e56	examples/configs/recipes/llm/autoresearch/convert-glm5.1-18n4g-megatron-tp1pp18ep4.yaml	config_preflight_exit_code	0	0.0	2.72	sbatch	3146592	sbatch infra/slurm/cscs/autoresearch/preflight_glm51_megatron_conversion.slurm	.tmp/glm51-async-topology/logs/glm51_megatron_conversion/config_3146592.out	keep	Exact actor TE import; topology and memory preflight; NeMo cache 4/4 and Bridge validation propagation 2/2 passed; COMPLETED 0:0
14	glm5p1-conversion	autoresearch/2026-08-22-glm51-async/tp32-throughput-10step	5c53ef91f7c47420ae490ab392ab5b3bd0486a96	089a9a6fb2074d7676b5eb1192d81a93ed455e56	examples/configs/recipes/llm/autoresearch/convert-glm5.1-18n4g-megatron-tp1pp18ep4.yaml	complete_checkpoint	0	0.0	1.68	sbatch	3146603	sbatch infra/slurm/cscs/autoresearch/convert_glm51_megatron.slurm	.tmp/glm51-async-topology/3146603-logs/ray-driver.log	crash	Ray 72/72 and topology preflight passed; driver interpreter lacked the source Bridge path and failed import before actor/model work; no cache written
15	glm5p1-conversion-config	autoresearch/2026-08-22-glm51-async/tp32-throughput-10step	089a9a6fb2074d7676b5eb1192d81a93ed455e56	074f442eb	examples/configs/recipes/llm/autoresearch/convert-glm5.1-18n4g-megatron-tp1pp18ep4.yaml	driver_import_exit_code	1	0.0	0.52	sbatch	3146609	sbatch infra/slurm/cscs/autoresearch/preflight_glm51_megatron_conversion.slurm	.tmp/glm51-async-topology/logs/glm51_megatron_conversion/config_3146609.err	crash	Bridge source import reached transitive megatron.core import, absent from /opt/nemo_rl_venv; failed before model work
16	glm5p1-conversion-config	autoresearch/2026-08-22-glm51-async/tp32-throughput-10step	074f442eb	4692c1fb0	examples/configs/recipes/llm/autoresearch/convert-glm5.1-18n4g-megatron-tp1pp18ep4.yaml	config_preflight_exit_code	0	0.0	3.27	sbatch	3146621	sbatch infra/slurm/cscs/autoresearch/preflight_glm51_megatron_conversion.slurm	.tmp/glm51-async-topology/logs/glm51_megatron_conversion/config_3146621.out	keep	Exact Megatron actor Python imported TE, MCore, Bridge and full conversion driver; topology/memory and six focused tests passed; COMPLETED 0:0
17	glm5p1-conversion	autoresearch/2026-08-22-glm51-async/tp32-throughput-10step	074f442eb	4692c1fb0	examples/configs/recipes/llm/autoresearch/convert-glm5.1-18n4g-megatron-tp1pp18ep4.yaml	complete_checkpoint	0	0.0	5.95	sbatch	3146627	sbatch infra/slurm/cscs/autoresearch/convert_glm51_megatron.slurm	.tmp/glm51-async-topology/3146627-logs/ray-driver.log	crash	Ray 72/72 and all import gates passed; driver Ray temp path exceeded AF_UNIX 107-byte socket limit before policy actors; no checkpoint evidence
18	apertus70b	autoresearch/2026-08-22-gh200-throughput/tp8pp2	a2de667546e760134ca50cd27fed5d556208e7be	uncommitted	reports/auto_research/20260822-apertus70b-topology/tp8pp2/launch_tp8pp2.slurm	contract_gate	0	0.0	0.17	sbatch	3146631	sbatch launch_tp8pp2.slurm	.none	crash	Cancelled before model work because the new TP8/PP2 launcher case had not been committed; no topology evidence
19	apertus70b	autoresearch/2026-08-22-gh200-throughput/tp8pp2	a2de667546e760134ca50cd27fed5d556208e7be	021368473d982eb06638f1687c47f1d41b1b8091	reports/auto_research/20260822-apertus70b-topology/tp8pp2/tp8pp2.yaml	steady_training_mfu_percent	14.7326	70.173	22.97	sbatch	3146827	sbatch launch_tp8pp2.slurm 021368473d982eb06638f1687c47f1d41b1b8091	.tmp/apertus70b-tp8pp2/reports/auto_research/20260822-apertus70b-topology/tp8pp2/runs/tp8pp2_3146827/summary.json	discard	COMPLETED 0:0; steady steps 3-10 mean 24.301 s, 145.78 TFLOP/s/GPU, 14.73% external MFU, 68.22 valid tok/s/GPU; lower HBM but slower than TP4/PP4 due cross-node TP8
20	glm5p1-conversion-config	autoresearch/2026-08-22-glm51-async/tp32-throughput-10step	4692c1fb0	920b1b5dd586d1546897bcfd039a0e69b50408ba	examples/configs/recipes/llm/autoresearch/convert-glm5.1-18n4g-megatron-tp1pp18ep4.yaml	config_preflight_exit_code	0	0.0	3.17	sbatch	3146828	sbatch infra/slurm/cscs/autoresearch/preflight_glm51_megatron_conversion.slurm	.tmp/glm51-async-topology/logs/glm51_megatron_conversion/config_3146828.out	keep	Short Ray socket path measured 75 of 107 bytes; exact imports, topology/memory and six focused tests passed; COMPLETED 0:0
21	glm5p1-conversion	autoresearch/2026-08-22-glm51-async/tp32-throughput-10step	4692c1fb0	920b1b5dd586d1546897bcfd039a0e69b50408ba	examples/configs/recipes/llm/autoresearch/convert-glm5.1-18n4g-megatron-tp1pp18ep4.yaml	complete_checkpoint	0	0.0	7.82	sbatch	3146889	infra/slurm/cscs/autoresearch/submit_glm51_megatron_conversion.sh	.tmp/glm51-async-topology/3146889-logs/ray-driver.log	crash	Ray 72/72 and actor NCCL passed; driver asserted metadata before asynchronous actor constructors reached HF import, then teardown interrupted them; no cache file written
22	glm5p1-conversion-config	autoresearch/2026-08-22-glm51-async/tp32-throughput-10step	920b1b5dd586d1546897bcfd039a0e69b50408ba	e5a9eca4ad49	examples/configs/recipes/llm/autoresearch/convert-glm5.1-18n4g-megatron-tp1pp18ep4.yaml	readiness_test_selected	0	0.0	3.28	sbatch	3146976	sbatch infra/slurm/cscs/autoresearch/preflight_glm51_megatron_conversion.slurm	.tmp/glm51-async-topology/logs/glm51_megatron_conversion/config_3146976.out	discard	COMPLETED 0:0 but the new readiness regression was deselected because it lacked the mcore marker; not accepted as a launch gate
23	glm5p1-async-throughput-config	autoresearch/2026-08-22-glm51-async/tp32-throughput-10step	b86829201	d1626290b69d	examples/configs/recipes/llm/autoresearch/grpo-glm5.1-80n4g-megatron-async-vllm-tp32-throughput.yaml	format_gate_exit_code	1	0.0	0.72	sbatch	3146977	sbatch infra/slurm/cscs/autoresearch/preflight_glm51_async_benchmark.slurm	.tmp/glm51-async-topology/logs/glm51_async_benchmark/config_3146977.err	crash	Semantic gates passed; exact Ruff formatting gate failed on test-only mechanical formatting and no model job was launched
24	glm5p1-async-throughput-config	autoresearch/2026-08-22-glm51-async/tp32-throughput-10step	d1626290b69d	f1a5258cef5ed058fd07e1ce2ad0c5b1dce88041	examples/configs/recipes/llm/autoresearch/grpo-glm5.1-80n4g-megatron-async-vllm-tp32-throughput.yaml	benchmark_evidence_gate_exit_code	0	0.0	1.73	sbatch	3146985	sbatch infra/slurm/cscs/autoresearch/preflight_glm51_async_benchmark.slurm	.tmp/glm51-async-topology/logs/glm51_async_benchmark/config_3146985.out	keep	COMPLETED 0:0; DAPO hash/count, topology/refit config, 8/8 focused evidence tests, Ruff check and exact formatting all passed
25	glm5p1-conversion-config	autoresearch/2026-08-22-glm51-async/tp32-throughput-10step	e5a9eca4ad49	f1a5258cef5ed058fd07e1ce2ad0c5b1dce88041	examples/configs/recipes/llm/autoresearch/convert-glm5.1-18n4g-megatron-tp1pp18ep4.yaml	conversion_gate_exit_code	0	0.0	3.23	sbatch	3146988	sbatch infra/slurm/cscs/autoresearch/preflight_glm51_megatron_conversion.slurm	.tmp/glm51-async-topology/logs/glm51_megatron_conversion/config_3146988.out	keep	COMPLETED 0:0; selected readiness regression passed in NeMo 5/5, Bridge save/load validation 2/2, and exact imports/topology preflights passed
26	glm5p1-conversion	autoresearch/2026-08-22-glm51-async/tp32-throughput-10step	920b1b5dd586d1546897bcfd039a0e69b50408ba	f1a5258cef5ed058fd07e1ce2ad0c5b1dce88041	examples/configs/recipes/llm/autoresearch/convert-glm5.1-18n4g-megatron-tp1pp18ep4.yaml	complete_checkpoint	0	0.0	13.33	sbatch	3147000	bash infra/slurm/cscs/autoresearch/submit_glm51_megatron_conversion.sh	.tmp/glm51-async-topology/logs/glm51_megatron_conversion/run_20260822T015743Z_35617/run.log	crash	FAILED 1:0 after writing 72 rank files plus metadata.json, 1.488 TB total; runtime config forced cudnn DSA but exact actor venv lacks flash_mla and cudnn-frontend DSA; no readiness/reload acceptance
27	glm5p1-async-throughput-config	autoresearch/2026-08-22-glm51-async/tp32-throughput-10step	f1a5258cef5ed058fd07e1ce2ad0c5b1dce88041	04a7d42a8bca95a8c30a34507a82d1e64e4bf0d1	examples/configs/recipes/llm/autoresearch/grpo-glm5.1-80n4g-megatron-async-vllm-tp32-benchmark.yaml	benchmark_evidence_gate_exit_code	0	0.0	1.73	sbatch	3147048	sbatch infra/slurm/cscs/autoresearch/preflight_glm51_async_benchmark.slurm	.tmp/glm51-async-topology/logs/glm51_async_benchmark/config_3147048.out	keep	COMPLETED 0:0; PyTorch DSA fallback resolved, topology/data/provenance gates, 8/8 evidence tests and Ruff passed
28	glm5p1-conversion-config	autoresearch/2026-08-22-glm51-async/tp32-throughput-10step	f1a5258cef5ed058fd07e1ce2ad0c5b1dce88041	04a7d42a8bca95a8c30a34507a82d1e64e4bf0d1	examples/configs/recipes/llm/autoresearch/convert-glm5.1-18n4g-megatron-tp1pp18ep4.yaml	conversion_gate_exit_code	0	0.0	3.22	sbatch	3147049	sbatch infra/slurm/cscs/autoresearch/preflight_glm51_megatron_conversion.slurm	.tmp/glm51-async-topology/logs/glm51_megatron_conversion/config_3147049.out	keep	COMPLETED 0:0; all 7 selected NeMo cache/barrier tests and 2/2 Bridge save/load tests passed with fallback config
29	glm5p1-async-config	autoresearch/2026-08-22-glm51-async/tp32-throughput-10step	f1a5258cef5ed058fd07e1ce2ad0c5b1dce88041	04a7d42a8bca95a8c30a34507a82d1e64e4bf0d1	examples/configs/recipes/llm/autoresearch/grpo-glm5.1-80n4g-megatron-async-vllm-tp32-smoke.yaml	config_preflight_exit_code	0	0.0	0.73	sbatch	3147050	sbatch infra/slurm/cscs/autoresearch/preflight_glm51_async_config.slurm	.tmp/glm51-async-topology/logs/glm51_async_smoke/config_3147050.out	keep	COMPLETED 0:0; smoke topology, fallback backend, async age, importance sampling and NCCL refit config passed
30	glm5p1-conversion-load	autoresearch/2026-08-22-glm51-async/tp32-throughput-10step	f1a5258cef5ed058fd07e1ce2ad0c5b1dce88041	04a7d42a8bca95a8c30a34507a82d1e64e4bf0d1	examples/configs/recipes/llm/autoresearch/convert-glm5.1-18n4g-megatron-tp1pp18ep4.yaml	complete_checkpoint_reload	0	0.0	10.28	sbatch	3147064	bash infra/slurm/cscs/autoresearch/submit_glm51_megatron_conversion.sh	.tmp/glm51-async-topology/logs/glm51_megatron_conversion/run_20260822T022215Z_135583/run.log	crash	CANCELLED after MCore bare python3 and python3-config resolved host Python 3.12 instead of actor Python 3.13; cache reuse marker passed but helpers_cpp compile failed and ranks hung before model setup
31	glm5p1-conversion-load	autoresearch/2026-08-22-glm51-async/tp32-throughput-10step	04a7d42a8bca95a8c30a34507a82d1e64e4bf0d1	5ca7029c1d3632b9b2c129caddd129d369e9aead	examples/configs/recipes/llm/autoresearch/convert-glm5.1-18n4g-megatron-tp1pp18ep4.yaml	complete_checkpoint_reload	1	35.30	11.33	sbatch	3147363	bash infra/slurm/cscs/autoresearch/submit_glm51_megatron_conversion.sh	.tmp/glm51-async-topology/logs/glm51_megatron_conversion/run_20260822T024559Z_260585/run.log	keep	COMPLETED 0:0; reused all 72 shards without HF conversion, 72/72 after_model_setup and init_complete, Python 3.13 helper gates passed, minimum free HBM 37.905 GB
32	glm5p1-async-smoke	autoresearch/2026-08-22-glm51-async/tp32-throughput-10step	5ca7029c1d3632b9b2c129caddd129d369e9aead	5ca7029c1d3632b9b2c129caddd129d369e9aead	examples/configs/recipes/llm/autoresearch/grpo-glm5.1-80n4g-megatron-async-vllm-tp32-smoke.yaml	steps_completed	0	0.0	12.93	sbatch	3147380	bash infra/slurm/cscs/autoresearch/submit_glm51_async_smoke.sh	.tmp/glm51-async-topology/3147380-logs/ray-driver.log	crash	FAILED exit 1 after all 288 primary policy ranks loaded the complete DCP checkpoint; the inherited 0.01 KL penalty then initialized a second 288-rank reference policy whose fully-parallel object exchange produced corrupted pickle payloads. Benchmark held; correct the recipe to explicit KL-free GRPO as used by upstream large-model DAPO recipes.
33	glm5p1-async-config	autoresearch/2026-08-22-glm51-async/tp32-throughput-10step	5ca7029c1d3632b9b2c129caddd129d369e9aead	e9c225aeba224b9f95ff07625aab747009c5d779	examples/configs/recipes/llm/autoresearch/grpo-glm5.1-80n4g-megatron-async-vllm-tp32-smoke.yaml	config_preflight_exit_code	1	0.0	0.80	sbatch	3147400	sbatch --export=ALL,EXPERIMENT_DIR=$PWD infra/slurm/cscs/autoresearch/preflight_glm51_async_config.slurm	.tmp/glm51-async-topology/logs/glm51_async_smoke/config_3147400.out	keep	COMPLETED 0:0; exact image resolved the 288+32 topology, explicit reference-policy disable, max-age-1 async mode, importance sampling and NCCL reshard support.
34	glm5p1-async-throughput-config	autoresearch/2026-08-22-glm51-async/tp32-throughput-10step	5ca7029c1d3632b9b2c129caddd129d369e9aead	e9c225aeba224b9f95ff07625aab747009c5d779	examples/configs/recipes/llm/autoresearch/grpo-glm5.1-80n4g-megatron-async-vllm-tp32-benchmark.yaml	benchmark_evidence_gate_exit_code	1	0.0	1.87	sbatch	3147401	sbatch --export=ALL,EXPERIMENT_DIR=$PWD infra/slurm/cscs/autoresearch/preflight_glm51_async_benchmark.slurm	.tmp/glm51-async-topology/logs/glm51_async_benchmark/config_3147401.out	keep	COMPLETED 0:0; explicit reference-policy disable, DAPO SHA/count, exact topology, 10/10 evidence tests, Ruff, formatting and MCore analyzer import all passed.
35	glm5p1-async-smoke	autoresearch/2026-08-22-glm51-async/tp32-throughput-10step	5ca7029c1d3632b9b2c129caddd129d369e9aead	e9c225aeba224b9f95ff07625aab747009c5d779	examples/configs/recipes/llm/autoresearch/grpo-glm5.1-80n4g-megatron-async-vllm-tp32-smoke.yaml	steps_completed	0	0.0	23.45	sbatch	3147405	bash infra/slurm/cscs/autoresearch/submit_glm51_async_smoke.sh	.tmp/glm51-async-topology/logs/glm51_async_smoke/slurm_3147405.out	crash	FAILED 1:0 after all 288 primary policy ranks and the TP32/EP32 vLLM worker initialized; one head-node AsyncTrajectoryCollector uv exact sync failed transiently removing flashinfer_jit_cache .data with Directory not empty. No refit, trajectories or train step; benchmark held pending a tested venv-provisioning fix.
36	glm5p1-reference-load-fix	fix/glm-reference-object-load	58436eb548387f8f7238c55fb9aad46efffd3690	1308a77c3e4bc11e05cd4d1a84236aea6fe94107	infra/slurm/cscs/autoresearch/preflight_glm51_reference_load_fix.slurm	reference_load_unit_gate_exit_code	0	0.0	3.28	sbatch	3147416	sbatch --export=ALL,EXPERIMENT_DIR=$PWD infra/slurm/cscs/autoresearch/preflight_glm51_reference_load_fix.slurm	.tmp/glm-reference-object-load/logs/glm51_reference_load/config_3147416.out	crash	FAILED 1:0 only because the harness expected four tests in the --mcore-only shard; Bridge wiring 1/1 and NeMo setup 2/2 passed, while the two recipe tests were correctly deselected by that marker option.
