index	track	branch	parent_commit	commit	recipe	metric_name	metric_value	memory_gb	elapsed_min	launcher	job_id	command	log_path	status	description
68	glm5p1-reference-kl-runtime	fix/glm-reference-object-load	df824a6f42fd59b8121a7410e0e657abb87fc70d	df824a6f42fd59b8121a7410e0e657abb87fc70d	examples/configs/recipes/llm/autoresearch/grpo-glm5.1-80n4g-megatron-async-vllm-tp32-reference-smoke.yaml	reference_load_ranks	288	59.2	51.4	sbatch	3147795	infra/slurm/cscs/autoresearch/submit_glm51_reference_smoke.sh	.tmp/glm-reference-object-load/3147795-logs/ray-driver.log	crash	FAILED 1:0 during step-1 reference logprob after 288 primary/reference loads, initial refit, a full real-DAPO rollout and mixed rewards. Four actors on nid006299 exited together with identical native Ray SIGSEGV cores; peers cascaded with NCCL remote errors. No CUDA/Ray OOM or Python exception; node remained healthy. No KL or optimizer-step result.
69	glm5p1-reference-kl-runtime	fix/glm-reference-object-load	df824a6f42fd59b8121a7410e0e657abb87fc70d	df824a6f42fd59b8121a7410e0e657abb87fc70d	examples/configs/recipes/llm/autoresearch/grpo-glm5.1-80n4g-megatron-async-vllm-tp32-reference-smoke.yaml	nonzero_reference_kl	0	0.0	0.0	sbatch	pending	infra/slurm/cscs/autoresearch/submit_glm51_reference_smoke.sh	.tmp/glm-reference-object-load/logs/glm51_reference_smoke/slurm_pending.out	running	Unchanged exact-commit rerun on a fresh 80-node allocation after one node-local native crash. Require scheduler COMPLETED 0:0, 288 reference loads, mixed rewards, three finite loss-bearing train/refit steps, and at least one strictly positive post-update KL.
70	glm5p1-reference-kl-runtime	fix/glm-reference-object-load	df824a6f42fd59b8121a7410e0e657abb87fc70d	df824a6f42fd59b8121a7410e0e657abb87fc70d	examples/configs/recipes/llm/autoresearch/grpo-glm5.1-80n4g-megatron-async-vllm-tp32-reference-smoke.yaml	nonzero_reference_kl	0	0.0	0.0	sbatch	3147942	infra/slurm/cscs/autoresearch/submit_glm51_reference_smoke.sh	.tmp/glm-reference-object-load/logs/glm51_reference_smoke/slurm_3147942.out	running	Fresh-node unchanged retry is RUNNING on 80 nodes. Same immutable candidate, exact e941 image, shared GLM DCP cache and strict three-step KL validator; no source/config change after the native crash.
71	apertus1p5-70b-direct-hf	autoresearch/2026-08-22-apertus70b-async/e2e	05c2640cb1c0859abb3e983655ea30e3bead5812	05c2640cb1c0859abb3e983655ea30e3bead5812	infra/slurm/cscs/probe_nemo_rl_vllm0251_image.py	direct_hf_generated_tokens_per_sec	263.75	0.0	7.53	sbatch	3147915	sbatch --export exact image and Apertus70B checkpoint infra/slurm/cscs/probe_nemo_rl_vllm0251_tp4_image.slurm	.tmp/apertus70b-direct-hf/run.log	keep	COMPLETED 0:0. Exact-image raw-HF TP4 generated 256 tokens and a correct coherent reinforcement-learning explanation, proving the checkpoint and tokenizer are not generally corrupt. A matched DAPO-prompt control remains necessary before attributing the zero-reward refit run to transfer parity.
72	apertus1p5-70b-async-config	autoresearch/2026-08-22-apertus70b-async/e2e	347a77f62747bf6d7eb6507655d86a2983588496	887c95987dd0f5a86ca6d6b76c9dbbdd747db5c4	infra/slurm/cscs/autoresearch/submit_apertus70b_async_smoke.sh	matched_control_final_head_gate	0	0.0	0.0	sbatch	3147944	APERTUS70B_PREFLIGHT_ONLY=1 infra/slurm/cscs/autoresearch/submit_apertus70b_async_smoke.sh	.tmp/apertus70b-async/3147944-logs/ray-driver.log	running	Exact-image gate for the committed matched DAPO-prompt raw-HF control, retaining CUDA xIELU forward/backward, config/tokenizer/topology checks, four focused tests, Ruff, formatting and shell syntax before launch.
73	apertus1p5-70b-direct-hf-math	autoresearch/2026-08-22-apertus70b-async/e2e	347a77f62747bf6d7eb6507655d86a2983588496	887c95987dd0f5a86ca6d6b76c9dbbdd747db5c4	infra/slurm/cscs/autoresearch/probe_apertus70b_direct_hf_math.py	matched_dapo_direct_hf_generated_tokens_per_sec	509.13	0.0	8.38	sbatch	3147953	sbatch --nodes=1 --gpus-per-node=4 --wrap matched-direct-hf-math	.tmp/apertus70b-direct-hf-math/evidence_887c9598.json	keep	COMPLETED 0:0. Raw-HF TP4 generated 3,774 tokens from eight samples over the exact four DAPO prompts. Most samples were incorrect or length-truncated, so the failed refit run's all-zero reward batch is consistent with checkpoint/task difficulty rather than proving transfer corruption; full nonzero learning evidence remains open.
74	apertus1p5-70b-async-config	autoresearch/2026-08-22-apertus70b-async/e2e	887c95987dd0f5a86ca6d6b76c9dbbdd747db5c4	58ffe9ae1eeb088408c2b2cb79b0c1e1a55627e7	infra/slurm/cscs/autoresearch/submit_apertus70b_async_smoke.sh	xielu_split_final_head_gate	1	0.0	2.13	sbatch	3147963	APERTUS70B_PREFLIGHT_ONLY=1 infra/slurm/cscs/autoresearch/submit_apertus70b_async_smoke.sh	.tmp/apertus70b-async/3147963-logs/ray-driver.log	keep	COMPLETED 0:0. Exact image validated the split environment on final head 58ffe9ae1: config boundary passed, BF16 CUDA xIELU forward/backward passed with input and alpha gradients, four focused tests passed, and Ruff plus format checks passed.
75	glm5p1-reference-kl-runtime	fix/glm-reference-object-load	df824a6f42fd59b8121a7410e0e657abb87fc70d	df824a6f42fd59b8121a7410e0e657abb87fc70d	examples/configs/recipes/llm/autoresearch/grpo-glm5.1-80n4g-megatron-async-vllm-tp32-reference-smoke.yaml	nonzero_reference_kl	0	77.35	50.88	sbatch	3147942	infra/slurm/cscs/autoresearch/submit_glm51_reference_smoke.sh	.tmp/glm-reference-object-load/3147942-logs/ray-driver.log	crash	FAILED 1:0 in step-1 reference logprob after 288 primary/reference loads, successful initial refit, full real-DAPO rollout, age 0 and mixed rewards. Slurm worker logs prove host-memory cgroup OOM kills on nid006658, nid007208 and nid007222; downstream NCCL and ActorUnavailable errors were cascade. Default submit requested only 450G/node although GH200 nodes expose 870G. GPU peak snapshot was 77.35 GiB, excluding HBM OOM. No KL or optimizer step completed.
76	glm5p1-reference-kl-runtime	fix/glm-reference-object-load	df824a6f42fd59b8121a7410e0e657abb87fc70d	b9be5fdf09819764bd93fb675f186eb8924aa9cb	examples/configs/recipes/llm/autoresearch/grpo-glm5.1-80n4g-megatron-async-vllm-tp32-reference-smoke.yaml	nonzero_reference_kl	0	0.0	0.0	sbatch	pending	infra/slurm/cscs/autoresearch/submit_glm51_reference_smoke.sh	.tmp/glm-reference-object-load/logs/glm51_reference_smoke/slurm_pending.out	running	Committed experiment-only retry requests full node host memory with --mem=0 after job 3147942 proved a 450G Slurm cgroup OOM. Exact image, recipe, DAPO data, topology and strict three-step KL gates remain unchanged. Require scheduler COMPLETED 0:0 and host RSS below the full-node limit.
77	glm5p1-reference-kl-runtime	fix/glm-reference-object-load	b9be5fdf09819764bd93fb675f186eb8924aa9cb	b9be5fdf09819764bd93fb675f186eb8924aa9cb	infra/slurm/cscs/autoresearch/submit_glm51_reference_smoke.sh	slurm_submission_gate	0	0.0	0.0	sbatch	none	--mem=0 submission	stderr	discard	No job was created. Slurm rejected --mem=0 because it expands to physical RealMemory 870000M while MaxMemPerNode is 850000M. This is a launcher-only preflight failure, not a runtime result.
78	glm5p1-reference-kl-runtime	fix/glm-reference-object-load	b9be5fdf09819764bd93fb675f186eb8924aa9cb	05a25bc8a346bfb5f158032001ca1ea705a57531	examples/configs/recipes/llm/autoresearch/grpo-glm5.1-80n4g-megatron-async-vllm-tp32-reference-smoke.yaml	nonzero_reference_kl	0	0.0	0.0	sbatch	pending	infra/slurm/cscs/autoresearch/submit_glm51_reference_smoke.sh	.tmp/glm-reference-object-load/logs/glm51_reference_smoke/slurm_pending.out	running	Committed retry requests the cluster maximum 850000M per node. Exact launcher argument was captured with SBATCH_BIN=/bin/echo; Bash syntax and diff checks passed. Runtime config, image, data and strict KL gates remain unchanged.
79	glm5p1-reference-kl-runtime	fix/glm-reference-object-load	b9be5fdf09819764bd93fb675f186eb8924aa9cb	05a25bc8a346bfb5f158032001ca1ea705a57531	examples/configs/recipes/llm/autoresearch/grpo-glm5.1-80n4g-megatron-async-vllm-tp32-reference-smoke.yaml	nonzero_reference_kl	0	0.0	0.0	sbatch	3148084	infra/slurm/cscs/autoresearch/submit_glm51_reference_smoke.sh	.tmp/glm-reference-object-load/logs/glm51_reference_smoke/slurm_3148084.out	running	850000M-per-node retry submitted from clean signed commit with exact e941 image, 288-rank training plus reference policy, real DAPO and strict three-step KL validator. Monitor host RSS, 288 reference loads, former step-1 boundary, all metrics and scheduler exit.
80	glm5p1-reference-kl-runtime	fix/glm-reference-object-load	05a25bc8a346bfb5f158032001ca1ea705a57531	05a25bc8a346bfb5f158032001ca1ea705a57531	examples/configs/recipes/llm/autoresearch/grpo-glm5.1-80n4g-megatron-async-vllm-tp32-reference-smoke.yaml	primary_checkpoint_load	0	0.0	0.0	sbatch	3148084	infra/slurm/cscs/autoresearch/submit_glm51_reference_smoke.sh	.tmp/glm-reference-object-load/logs/glm51_reference_smoke/slurm_3148084.out	crash	FAILED 1:0 before reference setup. Primary DCP load on 287 ranks failed in the WORLD object-exchange path at all_gather_object then torch.load(weights_only=True) with Unsupported operand 0. No host-memory OOM occurred. The base recipe had disabled sharding-integrity validation but had not enabled the Bridge per-rank object-load option. Fifty zero-byte job-created core_nid files were removed after terminal state; two older unrelated cores were preserved.
81	glm5p1-reference-config	fix/glm-reference-object-load	05a25bc8a346bfb5f158032001ca1ea705a57531	8f4cb265d8b2398175651b3ec114b37b00a271fd	infra/slurm/cscs/autoresearch/preflight_glm51_reference_load_fix.slurm	per_rank_checkpoint_objects	1	0.0	0.0	sbatch	pending	sbatch infra/slurm/cscs/autoresearch/preflight_glm51_reference_load_fix.slurm	logs/glm51_reference_load/config_pending.out	running	SSH-signed experiment commit enables ckpt_fully_parallel_load_per_rank_objects on the 288-rank GLM base recipe and adds a resolved-config regression. Require exact-e941 config, actor-workspace, Bridge and NeMo checkpoint tests, focused superproject tests, Ruff, formatting, Bash syntax and terminal COMPLETED 0:0 before any 80-node KL retry.
82	glm5p1-reference-config	fix/glm-reference-object-load	05a25bc8a346bfb5f158032001ca1ea705a57531	8f4cb265d8b2398175651b3ec114b37b00a271fd	infra/slurm/cscs/autoresearch/preflight_glm51_reference_load_fix.slurm	per_rank_checkpoint_objects	1	0.0	0.0	sbatch	3148471	sbatch infra/slurm/cscs/autoresearch/preflight_glm51_reference_load_fix.slurm	logs/glm51_reference_load/config_3148471.out	running	Fresh reservation one-node exact-e941 preflight submitted from clean SSH-signed head. This gate resolves the reference recipe and runs actor-workspace, Bridge/NeMo checkpoint, focused superproject, Ruff, formatting and Bash syntax checks before the 80-node KL retry.
83	glm5p1-reference-config	fix/glm-reference-object-load	8f4cb265d8b2398175651b3ec114b37b00a271fd	8f4cb265d8b2398175651b3ec114b37b00a271fd	infra/slurm/cscs/autoresearch/preflight_glm51_reference_load_fix.slurm	per_rank_checkpoint_objects	1	0.0	0.0	sbatch	3148471	sbatch infra/slurm/cscs/autoresearch/preflight_glm51_reference_load_fix.slurm	logs/glm51_reference_load/config_3148471.out	keep	COMPLETED 0:0 in 2m49s. Exact e941 image resolved the 288-rank reference recipe; actor workspace and lock dry-run passed; Bridge checkpoint test passed; NeMo checkpoint/reference tests passed; 50 focused superproject tests passed; Ruff, formatting and Bash syntax passed; terminal marker glm51_reference_load_fix_preflight=OK.
84	glm5p1-reference-kl-runtime	fix/glm-reference-object-load	05a25bc8a346bfb5f158032001ca1ea705a57531	8f4cb265d8b2398175651b3ec114b37b00a271fd	examples/configs/recipes/llm/autoresearch/grpo-glm5.1-80n4g-megatron-async-vllm-tp32-reference-smoke.yaml	nonzero_reference_kl	0	0.0	0.0	sbatch	pending	infra/slurm/cscs/autoresearch/submit_glm51_reference_smoke.sh	logs/glm51_reference_smoke/slurm_pending.out	running	Terminal-green exact-image preflight 3148471 gates this retry. Signed recipe loads small checkpoint objects per rank, requests 850000M/node, and otherwise preserves the exact image, 288+32 topology, real DAPO and three-step KL validator. Require 288 primary and reference loads, refit, mixed signal, three learning steps, strictly positive post-update KL and scheduler COMPLETED 0:0.
85	glm5p1-reference-kl-runtime	fix/glm-reference-object-load	05a25bc8a346bfb5f158032001ca1ea705a57531	8f4cb265d8b2398175651b3ec114b37b00a271fd	examples/configs/recipes/llm/autoresearch/grpo-glm5.1-80n4g-megatron-async-vllm-tp32-reference-smoke.yaml	nonzero_reference_kl	0	0.0	0.0	sbatch	3148506	infra/slurm/cscs/autoresearch/submit_glm51_reference_smoke.sh	logs/glm51_reference_smoke/slurm_3148506.out	running	80-node 850000M-per-node retry submitted from clean SSH-signed head after exact-image preflight 3148471 COMPLETED 0:0. Monitor primary per-rank DCP load, 288 reference loads, initial refit, real-DAPO signal, three finite learning/refit steps, post-update nonzero KL, terminal validator artifact and scheduler 0:0.
86	apertus1p5-70b-async-refit-fix	fix/apertus-pp-refit-static-state	abdfe0375	abdfe0375	examples/configs/recipes/llm/autoresearch/grpo-apertus1p5-70b-5n4g-megatron-async-vllm-tp4-smoke.yaml	generation_kl_error	0	0.0	17.07	sbatch	3149468	APERTUS70B_SOURCE_OVERLAY=1 infra/slurm/cscs/autoresearch/submit_apertus70b_async_smoke.sh	.tmp/apertus-refit-fix/logs/apertus70b_async_smoke/run_20260822T123838Z_248923/run.log	crash	FAILED 1:0 before model load/refit: NCCL/OFI config broadcast reported PTLTE_NOT_FOUND and VNI_NOT_FOUND. Identical cache/venv/topology loaded previously; preserve cache and retry on a fresh allocation.
87	apertus1p5-70b-async-refit-fix	fix/apertus-pp-refit-static-state	abdfe0375	abdfe0375	examples/configs/recipes/llm/autoresearch/grpo-apertus1p5-70b-5n4g-megatron-async-vllm-tp4-smoke.yaml	generation_kl_error	0	0.0	0.0	sbatch	3149806	APERTUS70B_SOURCE_OVERLAY=1 infra/slurm/cscs/autoresearch/submit_apertus70b_async_smoke.sh	.tmp/apertus-refit-fix/logs/apertus70b_async_smoke/slurm_3149806.out	running	Fresh five-node retry from clean abdfe0375 after removing one zero-byte core_nid artifact. Require three refits/steps, finite nonzero learning metrics, low generation KL, terminal artifact and scheduler COMPLETED 0:0.
88	glm5p1-reference-kl-runtime	fix/glm-reference-object-load	8f4cb265d8b2398175651b3ec114b37b00a271fd	8f4cb265d8b2398175651b3ec114b37b00a271fd	examples/configs/recipes/llm/autoresearch/grpo-glm5.1-80n4g-megatron-async-vllm-tp32-reference-smoke.yaml	nonzero_reference_kl	0	0.0	48.63	sbatch	3148506	infra/slurm/cscs/autoresearch/submit_glm51_reference_smoke.sh	.tmp/glm-reference-object-load/3148506-logs/ray-driver.log	crash	FAILED 1:0 after primary/reference loads and initial refit. Reference-logprob distributed collectives timed out and actors became unavailable; no optimizer step or KL result completed.
89	glm5p1-cross-allocation-checkpoint	autoresearch/2026-08-22-glm51-checkpoint-resume/cross-allocation	a170dc2d9fa0e8ca9dd9bc7bc3f6766a0d2c6f41	a170dc2d9fa0e8ca9dd9bc7bc3f6766a0d2c6f41	examples/configs/recipes/llm/autoresearch/grpo-glm5.1-80n4g-megatron-async-vllm-tp32-checkpoint-save.yaml	async_checkpoint_rank_shards	288	272	197.0	sbatch	3148504	checkpoint Phase A save	.tmp/glm51-checkpoint-resume/3148504-logs/ray-driver.log	running	Step 1 training/refit completed and async DCP scheduled. Checkpoint remains tmp_step_1 with 272/288 rank files, 7.6 TiB total, 16 missing shards and no driver progress after save scheduling; Phase B held.
90	apertus1p5-70b-async-refit-fix	fix/apertus-pp-refit-static-state	abdfe0375	abdfe0375	examples/configs/recipes/llm/autoresearch/grpo-apertus1p5-70b-5n4g-megatron-async-vllm-tp4-smoke.yaml	generation_kl_error	0	0.0	29.23	sbatch	3149806	APERTUS70B_SOURCE_OVERLAY=1 infra/slurm/cscs/autoresearch/submit_apertus70b_async_smoke.sh	.tmp/apertus-refit-fix/logs/apertus70b_async_smoke/run_20260822T131632Z_248118/run.log	crash	Application exited 1 after repeating the fresh-allocation NCCL/OFI read_run_config broadcast failure with PTLTE_NOT_FOUND and VNI_NOT_FOUND. Ray and actor venv setup completed; vLLM loaded and all 16 Megatron ranks initialized NCCL, but checkpoint/model load, refit, KL, rollout and training never began. Scheduler accounting was temporarily unavailable; wrapper terminal marker is exit_code=1.
91	apertus-ofi-env-diagnosis	fix/apertus-pp-refit-static-state	abdfe0375	abdfe0375	.tmp/ofi_probe/probe_ray_nccl_broadcast.py	ray_nccl_object_broadcast	1	0.0	0.0	sbatch	pending	ray.sub with inherited sbatch --export=ALL	.tmp/apertus-refit-fix/ofi-probe-dirty/pending-logs/ray-driver.log	running	Two-node/eight-rank matched reproducer for the launcher-leaked parent CUDA12 OFI/NCCL environment. Require the exact PTLTE_NOT_FOUND/VNI_NOT_FOUND signature or a clean terminal result before attribution.
92	apertus-ofi-env-diagnosis	fix/apertus-pp-refit-static-state	abdfe0375	abdfe0375	.tmp/ofi_probe/probe_ray_nccl_broadcast.py	ray_nccl_object_broadcast	1	0.0	0.0	sbatch	pending	ray.sub with explicit clean CSCS OFI allowlist	.tmp/apertus-refit-fix/ofi-probe-clean/pending-logs/ray-driver.log	running	Matched two-node/eight-rank control: no inherited allocation state, cuda-dl-compatible values, NCCL_NET AWS Libfabric, GDR PHB, TX 16384 and no NCCL_NET_PLUGIN or LD_PRELOAD. Require object broadcast, all-reduce, barrier and scheduler COMPLETED 0:0.
93	apertus-ofi-env-diagnosis	fix/apertus-pp-refit-static-state	abdfe0375	abdfe0375	.tmp/ofi_probe/probe_ray_nccl_broadcast.py	ray_nccl_object_broadcast	1	0.0	0.0	sbatch	3150489	ray.sub with explicit clean CSCS OFI allowlist	.tmp/apertus-refit-fix/ofi-probe-clean/3150489-logs/ray-driver.log	running	Matched clean control submitted with only explicit CSCS OFI variables: NCCL_NET AWS Libfabric, GDR PHB, TX 16384, FI provider cxi, no NCCL_NET_PLUGIN, no OCI parent hook and no LD_PRELOAD.
94	apertus-ofi-env-diagnosis	fix/apertus-pp-refit-static-state	abdfe0375	abdfe0375	.tmp/ofi_probe/probe_ray_nccl_broadcast.py	ray_nccl_object_broadcast	1	0.0	0.0	sbatch	3150490	ray.sub with inherited sbatch --export=ALL	.tmp/apertus-refit-fix/ofi-probe-dirty/3150490-logs/ray-driver.log	running	Matched dirty probe submitted from compute allocation 3148603 with its CUDA12 OFI/NCCL profile, NCCL_NET_PLUGIN, GDR level 0, TX 32768, Slurm allocation variables and LD_PRELOAD inherited exactly through --export=ALL.
95	exact-image-build	chore/sync-upstream-7ea279abf	7ea279abfbeb698b092856d0dab61e7cf39bc909	084ade845b8421ab82dcda1849d913da517f194e	docker/Dockerfile	image_sha256	d53ec42a2c770ccd0b78536708e3959aaa984048adfee201675d49df8e8d837c	47.0	133.48	sbatch	3155280	infra/slurm/cscs/build_nemo_rl_image.slurm	.tmp/nemo-upstream-7ea-curated/logs/nrl-vllm0251-image_3155280.out	keep	COMPLETED 0:0. Exact 084ade image built through the two-allocation hermetic contract; valid SquashFS, vLLM 0.25.1 renderer/tokenization/tool-parser smoke green, 50,049,769,112 bytes.
96	apertus1p5-70b-exact-preflight	autoresearch/2026-08-23-apertus70b-cert/exact-image	084ade845b8421ab82dcda1849d913da517f194e	a196ee1a5	grpo-apertus1p5-70b-5n4g-megatron-async-vllm-tp4-smoke.yaml	exact_image_preflight	0	0.0	0.0	sbatch	3156315	APERTUS70B_PREFLIGHT_ONLY=1 submit_apertus70b_async_smoke.sh	.tmp/apertus70b-exact-cert/logs/apertus70b_async_smoke/slurm_3156315.out	running	One-node clean-ingress preflight for exact image identity, immutable checkpoint/cache/data, TP4/PP4 plus vLLM TP4 topology, and deterministic 64-row DAPO adapter.
97	apertus1p5-8b-pp2-refit	chore/sync-upstream-7ea279abf	7ea279abfbeb698b092856d0dab61e7cf39bc909	084ade845b8421ab82dcda1849d913da517f194e	grpo-apertus1p5-8b-1n4g-megatron-probe.yaml	generation_kl_error	0	0.0	0.0	sbatch	3156324	clean env-i sbatch MEGATRON_TP_SIZE=2 MEGATRON_PP_SIZE=2	.tmp/nemo-upstream-7ea-curated/logs/exact_pp2_20260823T0338/run.log	running	Permanent exact-image PP2 regression. Require baked source, refit, generation KL, backward/train, CUDA xIELU in training, and COMPLETED 0:0 before the 70B launch.
98	apertus1p5-8b-async	chore/sync-upstream-7ea279abf	7ea279abfbeb698b092856d0dab61e7cf39bc909	084ade845b8421ab82dcda1849d913da517f194e	grpo-apertus1p5-8b-1n4g-megatron-probe-async.yaml	async_grpo_exact_image	0	0.0	0.0	sbatch	3156321	clean env-i sbatch async GRPO	.tmp/nemo-upstream-7ea-curated/logs/exact_async_20260823T0338/run.log	running	Two-step exact-image async GRPO gate; require CUDA graphs, async scheduling, generation KL per step, successful refit, no training xIELU fallback, and COMPLETED 0:0.
99	sglang-text-exact-image	chore/sync-upstream-7ea279abf	7ea279abfbeb698b092856d0dab61e7cf39bc909	084ade845b8421ab82dcda1849d913da517f194e	grpo_math_1B_sglang.yaml	sglang_refit	0	0.0	0.0	sbatch	3156323	clean env-i sbatch SGLangGenerationWorker	.tmp/nemo-upstream-7ea-curated/logs/exact_sglang_20260823T0338/run.log	running	One-step exact-image SGLang text-path gate with DTensorV2; require successful HTTP weight update and cache flush plus COMPLETED 0:0.
100	apertus1p5-8b-cross-allocation-checkpoint	chore/sync-upstream-7ea279abf	7ea279abfbeb698b092856d0dab61e7cf39bc909	084ade845b8421ab82dcda1849d913da517f194e	dpo-apertus1p5-8b-maxmin-megatron.yaml	optimizer_checkpoint_restore	0	0.0	0.0	sbatch	3156322	clean env-i sbatch CHECKPOINT_MODE=save	.tmp/nemo-upstream-7ea-curated/logs/exact_dpo_save_20260823T0338/run.log	running	Cross-allocation checkpoint Phase A on the exact image. Require optimizer-aware step_1 plus archived step_2, semantic save marker, and COMPLETED 0:0 before Phase B is submitted in a fresh allocation.
