index	branch	parent_commit	commit	recipe	metric_name	metric_value	memory_gb	elapsed_min	launcher	job_id	command	log_path	status	description
1	autoresearch/2026-08-29-glm51-mtp3	d45ae63e0	d45ae63e0	grpo-glm5.1-136n4g-megatron-tp2pp18ep16-ready-first.yaml	completed_steps	10	95.6	pending	slurm	3217663	submit_glm51_sc_scale.sh	/iopsstor/scratch/cscs/xyixuan/nemo_rl_glm51_ready_first_64inf/*	keep	Matched non-speculative baseline; 10/10 steps, Router Replay trace passed, finite accepted generation KL
2	autoresearch/2026-08-29-glm51-mtp3	d45ae63e0	d45ae63e0	grpo-glm5.1-136n4g-megatron-tp2pp18ep16-ready-first-mtp3.yaml	completed_steps	8	95.6	59	slurm	3219292	submit_glm51_sc_mtp3.sh	/iopsstor/scratch/cscs/xyixuan/nemo_rl_glm51_ready_first_64inf_mtp3/*	crash	Native MTP and Router Replay proved; step 9 backward OOM on final PP stage and SingleController emitted no speculative counters
3	autoresearch/2026-08-31-glm51-mtp3-fused-counters	2e75f5612	e1af50b5a	grpo-glm5.1-136n4g-megatron-tp2pp18ep16-ready-first-mtp3.yaml	completed_steps	0	0	0	slurm	pending	submit_glm51_sc_mtp3.sh	pending	pending	Matched MTP3 rerun with fused chunked logprobs and certified SingleController speculative metrics
4	autoresearch/2026-08-31-glm51-mtp3-fused-counters	2e75f5612	5996994c2	grpo-glm5.1-136n4g-megatron-tp2pp18ep16-ready-first-mtp3.yaml	overlay_fingerprint	1	0	1	slurm	3238845	glm51_mtp3_overlay_probe.sbatch	.tmp/slurm-logs/glm51-overlay-probe/slurm_3238845.out	crash	New SQSH imported the shared overlay and matched its dependency fingerprint; focused test stopped because its fake sampler produced 1 group against a 2-group helper target
5	autoresearch/2026-08-31-glm51-mtp3-fused-counters	5996994c2	e1af50b5a	grpo-glm5.1-136n4g-megatron-tp2pp18ep16-ready-first-mtp3.yaml	focused_tests	15	0	2	slurm	3238849	glm51_mtp3_overlay_probe.sbatch	.tmp/slurm-logs/glm51-overlay-probe/slurm_3238849.out	keep	New SQSH fingerprint and shared overlay import passed; 15/15 focused tests and exact fused MTP3 profile certification passed
